<xs:schema attributeFormDefault="unqualified" elementFormDefault="qualified" xmlns:xs="http://www.w3.org/2001/XMLSchema">
  <xs:element name="carrental">
    <xs:complexType>
      <xs:sequence>
        <xs:element name="rental" maxOccurs="unbounded" minOccurs="0">
          <xs:complexType>
            <xs:sequence>
              <xs:element type="xs:string" name="make"/>
              <xs:element type="xs:string" name="model"/>
              <xs:element type="xs:byte" name="nofdays"/>
              <xs:element type="xs:byte" name="nofunits"/>
              <xs:element type="xs:byte" name="discount"/>
            </xs:sequence>
            <xs:attribute type="xs:short" name="id" use="optional"/>
          </xs:complexType>
        </xs:element>
      </xs:sequence>
    </xs:complexType>
  </xs:element>
</xs:schema>

